### ISSUE TITLE
Support external seed data

### ISSUE THREAD

**Issue by rgl** [lxc/incus-os#325]
Is it possible to configure incus-os using a cloud-init (or a subset of it) drive?

For example, [I'm trying to configure a proxmox vm with terraform](https://github.com/rgl/terraform-proxmox-incus-os/tree/wip) using this snippet to set the network configuration tru a cloud-init drive:

```hcl
# see https://registry.terraform.io/providers/bpg/proxmox/0.83.2/docs/resources/virtual_environment_vm
resource "proxmox_virtual_environment_vm" "incus_os" {
...
  initialization {
    ip_config {
      ipv4 {
        address = "${local.nodes[count.index].address}/24"
        gateway = var.cluster_node_network_gateway
      }
    }
  }
}
```

But it seems incus os ignores the `network-config` file that is inside the cloud-init cdrom (the cdrom drive that has the `cidata` label).

BTW, is it possible to configure incus os to load the qemu guest tools?

PS Using https://incusos-customizer.linuxcontainers.org/ui/ is interesting, but using it to get a custom image, just to set different parameters, is wasteful.

**Comment by stgraber** [comment]
The issue covers a few different points so I'll try to answer all of them separately.

1) We will not have cloud-init or something similar in our images.
2) We currently only read our seed data from the seed-data partition on the main drive, but I think we could be a bit more flexible on that part.
3) We don't plan on integrating the QEMU guest tools, that would increase our attack surface and we're generally expecting Incus OS to be run on bare metal.


For the seed data, I think we could also look for a `SEED_DATA` partition label or partition name (similar to `RESCUE_DATA`) and if we find that, then prefer it over the local `seed-data` partition.

I think for ease of use, the `SEED_DATA` partition could be expected to be `vfat` or `isofs`, same as with `RESCUE_DATA` rather than be formatted as a tarball like we do the internal `seed-data` partition.

**Comment by rgl** [comment]
That external seed data sounds good!

In anticipation, I've modified my https://github.com/rgl/terraform-proxmox-incus-os/tree/wip example to create a ISO with the `SEED_DATA` partition/volid using:

```bash
xorriso \
      -as genisoimage \
      -output "$INCUS_OS_SEED_DATA_ISO_PATH" \
      -volid SEED_DATA \
      -joliet \
      -rock \
      "$tmp_path"
```

The path at `$tmp_path` contains the following files.

`incus.yaml`:

```yaml
"apply_defaults": true
"preseed":
  "certificates":
  - "certificate": |
      -----BEGIN CERTIFICATE-----
      MIIB2zCCAWCgAwIBAgIQRi13E7xA1PJz0+4EBjF+njAKBggqhkjOPQQDAzA1MRkw
      FwYDVQQKExBMaW51eCBDb250YWluZXJzMRgwFgYDVQQDDA92YWdyYW50QGRtMS5s
      YW4wHhcNMjUwOTE0MTYyMjIxWhcNMzUwOTEyMTYyMjIxWjA1MRkwFwYDVQQKExBM
      aW51eCBDb250YWluZXJzMRgwFgYDVQQDDA92YWdyYW50QGRtMS5sYW4wdjAQBgcq
      hkjOPQIBBgUrgQQAIgNiAAQuK1i1Hpl5ZwcLWEVDrKK3d8WfMRf4ebgCF4797wBe
      EEbc9+k3iUjiA8myyFch4jZXv9ozE7NjbfWbecgpnAbLFPjuvzAjcmSduAEcms7D
      wJwOUW2agihiYzixMgoRppijNTAzMA4GA1UdDwEB/wQEAwIFoDATBgNVHSUEDDAK
      BggrBgEFBQcDAjAMBgNVHRMBAf8EAjAAMAoGCCqGSM49BAMDA2kAMGYCMQCXZqDf
      hScN++hZBCbKAEJel1eQiBDZ9avnkg+Gp9PWKIFq66ulOgEFOlsW8u9fv1ECMQC1
      OWCN1YRpFYUWX7bYbwdnkKs/jmvry2LkUH1i9EtixS3FIyRQvk4xyQD+4/T8Ndo=
      -----END CERTIFICATE-----
    "description": "Initial admin client"
    "name": "admin"
    "type": "client"
```

`network.yaml`:

```yaml
"interfaces":
- "addresses":
  - "192.168.8.80"
  "hwaddr": "bc:24:11:00:00:01"
  "required_for_online": true
  "routes":
  - "to": "default"
    "via": "192.168.8.1"
```

Thou, at runtime, incus does not seem to find any partitions on it (maybe because it ignores removable disk):

```bash
incus query incus-os-example:/os/1.0/system/resources | jq .storage.disks
```
```json
  {
    "block_size": 2048,
    "device": "11:0",
    "device_id": "ata-QEMU_DVD-ROM_QM00007",
    "device_path": "pci-0000:00:1f.2-ata-4.0",
    "firmware_version": "2.5+",
    "id": "sr0",
    "model": "QEMU DVD-ROM",
    "numa_node": 0,
    "partitions": [],
    "read_only": false,
    "removable": true,
    "rpm": 0,
    "serial": "QM00007",
    "size": 378880,
    "type": "cdrom"
  }
```
```bash
incus query incus-os-example:/os/1.0/system/storage
```
```json
{
        "config": {},
        "state": {
                "drives": [
...
                        {
                                "boot": false,
                                "bus": "scsi",
                                "capacity_in_bytes": 378880,
                                "id": "/dev/sr0",
                                "model_family": "QEMU",
                                "model_name": "QEMU DVD-ROM",
                                "remote": false,
                                "removable": true,
                                "serial_number": ""
                        }
                ],
```

BTW, that `bus: scsi` seems odd, because the cdrom is added as `ide3` in the proxmox vm configuration.

**Comment by stgraber** [comment]
> BTW, that `bus: scsi` seems odd, because the cdrom is added as `ide3` in the proxmox vm configuration.

/dev/sr0 is the name reserved for a device on the SCSI bus, so the Linux kernel is certainly using a SCSI driver for your CD-ROM drive. This may be because of Linux having moved some of the IDE handling logic over to the SCSI drivers or something like that.

**Comment by rgl** [comment]
@stgraber, @gibmat, I've tried it with [IncusOS_202509190020.img.gz](https://images.linuxcontainers.org/os/202509190020/x86_64/IncusOS_202509190020.img.gz) at https://github.com/rgl/terraform-proxmox-incus-os/tree/wip with the following files in the SEED_DATA ISO and incus os is picking it up :-)

But for some reason, the network is not working. It seems that it's trying to use IPv6, but that will not work in my network.

Is there something I'm missing?

Here's the screenshot of the incus-os vm console:

<img width="1024" height="768" alt="Image" src="https://github.com/user-attachments/assets/afc7470e-733a-4e46-aa34-27bf816f54ac" />

The `SEED_DATA` `network.yaml`:

```yaml
"dns":
  "domain": "test"
  "hostname": "incus0"
  "nameservers":
  - "192.168.8.1"
"interfaces":
- "addresses":
  - "192.168.8.80"
  "hwaddr": "bc:24:11:00:00:01"
  "name": "eth0"
  "routes":
  - "to": "0.0.0.0" # NB when trying to use "default", incus-os fails.
    "via": "192.168.8.1"
"ntp":
  "timeservers":
  - "pt.pool.ntp.org"
```

The `SEED_DATA` `incus.yaml`:

```yaml
"apply_defaults": true
"preseed":
  "certificates":
  - "certificate": |
      -----BEGIN CERTIFICATE-----
      MIIB2zCCAWCgAwIBAgIQRi13E7xA1PJz0+4EBjF+njAKBggqhkjOPQQDAzA1MRkw
      FwYDVQQKExBMaW51eCBDb250YWluZXJzMRgwFgYDVQQDDA92YWdyYW50QGRtMS5s
      YW4wHhcNMjUwOTE0MTYyMjIxWhcNMzUwOTEyMTYyMjIxWjA1MRkwFwYDVQQKExBM
      aW51eCBDb250YWluZXJzMRgwFgYDVQQDDA92YWdyYW50QGRtMS5sYW4wdjAQBgcq
      hkjOPQIBBgUrgQQAIgNiAAQuK1i1Hpl5ZwcLWEVDrKK3d8WfMRf4ebgCF4797wBe
      EEbc9+k3iUjiA8myyFch4jZXv9ozE7NjbfWbecgpnAbLFPjuvzAjcmSduAEcms7D
      wJwOUW2agihiYzixMgoRppijNTAzMA4GA1UdDwEB/wQEAwIFoDATBgNVHSUEDDAK
      BggrBgEFBQcDAjAMBgNVHRMBAf8EAjAAMAoGCCqGSM49BAMDA2kAMGYCMQCXZqDf
      hScN++hZBCbKAEJel1eQiBDZ9avnkg+Gp9PWKIFq66ulOgEFOlsW8u9fv1ECMQC1
      OWCN1YRpFYUWX7bYbwdnkKs/jmvry2LkUH1i9EtixS3FIyRQvk4xyQD+4/T8Ndo=
      -----END CERTIFICATE-----
    "description": "Initial admin client"
    "name": "admin"
    "type": "client"
```

Here's a tcpdump of the incus os vm made from the proxmox machine:

```
root@pve:~# tcpdump -i vmbr0 -n ether host bc:24:11:00:00:01
tcpdump: verbose output suppressed, use -v[v]... for full protocol decode
listening on vmbr0, link-type EN10MB (Ethernet), snapshot length 262144 bytes
07:31:53.944882 ARP, Request who-has 192.168.8.80 tell 192.168.8.1, length 46
07:31:53.945054 ARP, Reply 192.168.8.80 is-at bc:24:11:00:00:01, length 28
07:32:04.184277 ARP, Request who-has 192.168.8.80 tell 192.168.8.1, length 46
07:32:04.184490 ARP, Reply 192.168.8.80 is-at bc:24:11:00:00:01, length 28
07:32:14.424847 ARP, Request who-has 192.168.8.80 tell 192.168.8.1, length 46
07:32:14.425019 ARP, Reply 192.168.8.80 is-at bc:24:11:00:00:01, length 28
07:32:24.664079 ARP, Request who-has 192.168.8.80 tell 192.168.8.1, length 46
07:32:27.669202 IP6 :: > ff02::1:ff00:1: HBH ICMP6, multicast listener reportmax resp delay: 0 addr: ff02::1:ff00:1, length 24
07:32:27.969090 IP6 :: > ff02::1:ff00:1: ICMP6, neighbor solicitation, who has fe80::be24:11ff:fe00:1, length 24
07:32:34.904065 ARP, Request who-has 192.168.8.80 tell 192.168.8.1, length 46
07:32:45.144042 ARP, Request who-has 192.168.8.80 tell 192.168.8.1, length 46
07:32:45.228767 IP6 :: > ff02::16: HBH ICMP6, multicast listener report v2, 1 group record(s), length 28
07:32:45.318090 IP6 :: > ff02::16: HBH ICMP6, multicast listener report v2, 1 group record(s), length 28
07:32:45.438388 IP6 :: > ff02::1:ff00:1: ICMP6, neighbor solicitation, who has fe80::be24:11ff:fe00:1, length 32
07:32:45.728333 ARP, Request who-has 192.168.8.1 tell 192.168.8.80, length 28
07:32:45.728775 ARP, Reply 192.168.8.1 is-at 94:83:c4:aa:c2:c2, length 46
07:32:45.728974 IP 192.168.8.80.47561 > 192.168.8.1.53: 26214+ [1au] A? linuxcontainers.org. (48)
07:32:45.728976 IP 192.168.8.80.53942 > 192.168.8.1.53: 19310+ [1au] AAAA? linuxcontainers.org. (48)
07:32:45.730587 IP 192.168.8.1.53 > 192.168.8.80.47561: 26214 1/0/1 A 45.45.148.7 (64)
07:32:45.730589 IP 192.168.8.1.53 > 192.168.8.80.53942: 19310 1/0/1 AAAA 2602:fc62:a:1::7 (76)
07:32:45.812974 IP 192.168.8.80.34691 > 192.168.8.1.53: 36090+ [1au] A? pt.pool.ntp.org. (44)
07:32:45.813071 IP 192.168.8.80.45075 > 192.168.8.1.53: 4913+ [1au] AAAA? pt.pool.ntp.org. (44)
07:32:45.814367 IP 192.168.8.1.53 > 192.168.8.80.45075: 4913 0/1/1 (99)
07:32:45.829528 IP 192.168.8.1.53 > 192.168.8.80.34691: 36090 4/0/1 A 185.228.163.139, A 193.136.152.71, A 91.209.16.78, A 162.159.200.123 (108)
07:32:46.502451 IP6 fe80::be24:11ff:fe00:1 > ff02::16: HBH ICMP6, multicast listener report v2, 1 group record(s), length 28
07:32:47.398403 IP6 fe80::be24:11ff:fe00:1 > ff02::16: HBH ICMP6, multicast listener report v2, 1 group record(s), length 28
07:32:50.776015 ARP, Request who-has 192.168.8.80 tell 192.168.8.1, length 46
07:32:50.776199 ARP, Reply 192.168.8.80 is-at bc:24:11:00:00:01, length 28
07:32:55.384109 ARP, Request who-has 192.168.8.80 tell 192.168.8.1, length 46
07:32:55.384267 ARP, Reply 192.168.8.80 is-at bc:24:11:00:00:01, length 28
07:33:05.624683 ARP, Request who-has 192.168.8.80 tell 192.168.8.1, length 46
07:33:05.624938 ARP, Reply 192.168.8.80 is-at bc:24:11:00:00:01, length 28
07:33:15.863927 ARP, Request who-has 192.168.8.80 tell 192.168.8.1, length 46
07:33:15.864109 ARP, Reply 192.168.8.80 is-at bc:24:11:00:00:01, length 28
07:33:16.189373 IP 192.168.8.80.49030 > 192.168.8.1.53: 50577+ [1au] AAAA? images.linuxcontainers.org. (55)
07:33:16.189522 IP 192.168.8.80.44811 > 192.168.8.1.53: 18438+ [1au] A? images.linuxcontainers.org. (55)
07:33:16.190992 IP 192.168.8.1.53 > 192.168.8.80.44811: 18438 1/0/1 A 45.45.148.8 (71)
07:33:16.190994 IP 192.168.8.1.53 > 192.168.8.80.49030: 50577 1/0/1 AAAA 2602:fc62:a:1::8 (83)
```

**Comment by stgraber** [comment]
Try using 0.0.0.0/0, otherwise you'd likely get 0.0.0.0/32 which wouldn't be useful as a route.

**Comment by rgl** [comment]
@stgraber, ah that was it! thanks! I was missing the cidrs in the default route and the machine ip address.

here's how it looks now, notice that the `config` object shows things slightly different than the `state` object (`"192.168.8.80/24"` vs `"192.168.8.80"`, `"0.0.0.0/0"` vs `"default"`):

```json
$ incus query incus-os-example:/os/1.0/system/network
{
        "config": {
                "dns": {
                        "domain": "test",
                        "hostname": "incus0",
                        "nameservers": [
                                "192.168.8.1"
                        ]
                },
                "interfaces": [
                        {
                                "addresses": [
                                        "192.168.8.80/24"
                                ],
                                "hwaddr": "bc:24:11:00:00:01",
                                "lldp": false,
                                "name": "eth0",
                                "routes": [
                                        {
                                                "to": "0.0.0.0/0",
                                                "via": "192.168.8.1"
                                        }
                                ]
                        }
                ],
                "ntp": {
                        "timeservers": [
                                "pt.pool.ntp.org"
                        ]
                }
        },
        "state": {
                "interfaces": {
                        "eth0": {
                                "addresses": [
                                        "192.168.8.80"
                                ],
                                "hwaddr": "bc:24:11:00:00:01",
                                "mtu": 1500,
                                "roles": [
                                        "management",
                                        "cluster"
                                ],
                                "routes": [
                                        {
                                                "to": "default",
                                                "via": "192.168.8.1"
                                        }
                                ],
                                "speed": "10Gbps",
                                "state": "routable",
                                "stats": {
                                        "rx_bytes": 287249553,
                                        "rx_errors": 0,
                                        "tx_bytes": 488385,
                                        "tx_errors": 0
                                },
                                "type": "interface"
                        }
                }
        }
}
```

**Comment by stgraber** [comment]
Yeah, the state is basically what we get back out of networkd/kernel, so effectively reports what the system is actually like after applying the configuration.
