### ISSUE TITLE
IncusOS forwards packets from all configured interfaces to all configured routes, with no way of applying a firewall rule that blocks this

### ISSUE THREAD

**Issue by programmablereya** [lxc/incus-os#1203]
**Any network that IncusOS knows how to route and is connected to will receive packets forwarded from any interface IncusOS has connected, even if the host IncusOS is not using that interface.**

Because of the way the firewall rules are written, where forwarding rules are only writable using a network ACL and network ACLs cannot be applied to the unmanaged bridges that IncusOS creates by default, there's no way I can see to block this from happening.

So this is, to say the least, _not_ what I would expect, and an incredibly powerful security footgun from an OS that otherwise makes a decent effort to keep things secure. I would expect no forwarding to take place on packets from any interface unless I specifically, personally command it to.

[The discussion topic where this was originally posted](https://discuss.linuxcontainers.org/t/incusos-forwarding-packets-between-bridges-by-default/26918)

The rest of the repro follows:

I have a simple reproduction for this, involving an IncusOS VM sitting opposite a Kali VM on two bridges:
* Bridge A gives addresses in the `192.168.122.0/24` subnet and is NATted to the rest of the world; this is how the client connects to it.
* Bridge B is completely isolated from the world and only consists of the two VMs.

testbed's network config (comments added by me):
```none
$ incus admin os system network show testbed:
WARNING: The IncusOS API and configuration is subject to change

config:
  interfaces:
    - addresses:
        - dhcp4 # 192.168.122.128/24, default gateway 192.168.122.1
      hwaddr: 52:54:00:e3:b0:ba # on bridge A
      name: enp1s0
      required_for_online: 'no'
      routes:
        - to: 10.0.0.0/8
          via: 192.168.122.19
    - hwaddr: 52:54:00:de:97:8a # on bridge B
      name: connected 
      required_for_online: 'no'
  time:
    timezone: UTC
```

Remote "testbed" is configured to talk to that VM: (output truncated to only the relevant entry)
```none
$ incus remote list
+-----------------+---------------------------------------------+---------------+-------------+--------+--------+--------+
|      NAME       |                     URL                     |   PROTOCOL    |  AUTH TYPE  | PUBLIC | STATIC | GLOBAL |
+-----------------+---------------------------------------------+---------------+-------------+--------+--------+--------+
| testbed         | https://192.168.122.128:8443                | incus         | tls         | NO     | NO     | NO     |
+-----------------+---------------------------------------------+---------------+-------------+--------+--------+--------+
```
I've deleted the nic from the default profile and deleted the default network (incusbr0), so there are _no_ managed networks on this machine:
```none
$ incus network list testbed:
+------+------+---------+------+------+-------------+---------+-------+
| NAME | TYPE | MANAGED | IPV4 | IPV6 | DESCRIPTION | USED BY | STATE |
+------+------+---------+------+------+-------------+---------+-------+
```
No instances either:
```none
$ incus list testbed: 
+------+-------+------+------+------+-----------+
| NAME | STATE | IPV4 | IPV6 | TYPE | SNAPSHOTS |
+------+-------+------+------+------+-----------+
```

The kali box is connected to bridge A via `eth0` and bridge B via `eth1`.

Use scapy on the kali box's eth1, writing to the bridge B and writing to routes that the above network configuration thinks should exit via bridge A:
```
$ sudo scapy
>>> sendp(Ether(dst="52:54:00:de:97:8a")/IP(dst="192.168.122.19",src="192.168.122.80")/ICMP(), iface="eth1")
.
Sent 1 packets.
>>> sendp(Ether(dst="52:54:00:de:97:8a")/IP(dst="10.0.10.5",src="192.168.122.80")/ICMP(), iface="eth1")
.
Sent 1 packets.
```

... and it shows up from the testbed's enp1s0 in tcpdump on the kali box's eth0, sniffing bridge A:
```
$ sudo tcpdump -i eth0 -s0 -Un ether src 52:54:00:e3:b0:ba
listening on eth0, link-type EN10MB (Ethernet), snapshot length 262144 bytes
20:34:59.345491 ARP, Request who-has 192.168.122.19 tell 192.168.122.128, length 28
20:34:59.346077 IP 192.168.122.80 > 192.168.122.19: ICMP echo request, id 0, seq 0, length 8
20:36:08.726671 IP 192.168.122.80 > 10.0.10.5: ICMP echo request, id 0, seq 0, length 8
```

Pause the IncusOS VM and it pauses the packets, and they're delivered when the VM is unpaused.

**Comment by programmablereya** [comment]
After much effort, I got a Debian Trixie VM up in which to install Incus in order to install IncusOS in full debug mode, and I was able to verify that forwarding is turned on for the whole system, by default for all interfaces, and on each real interface and bridge (presumably because of the aforementioned default setting) and there are no nftables rules that prevent this (or, really, anything; the nftables policies are all set to default accept, and their only rules are also accept).

Let's see if we can figure out why this is the case.

**Comment by programmablereya** [comment]
This appears to be the default with both the Zabbly kernel and the current Debian Trixie kernel, so essentially, "this Just Works because IncusOS does not explicitly do anything to prohibit it."

And because Debian functions the exact same way and doesn't have a firewall at all, this presumably means that a stock Debian VM is also going automatically to act as a router between any two or more networks that it's connected to. Let's investigate.

**Comment by stgraber** [comment]
Yeah, feels like some sysctl that needs to be set somewhere.

**Comment by moonpiedumplings** [comment]
This is more likely to be an issue with incomplete firewall rules. Ensure the firewall's forwarding policy is set to drop, and control bridge to bridge traffic there, which might not be happening due to Linux's allow all defaults.

Some investigation of sysctl: 

For sysctl, the global value used is: proc/sys/net/ipv4/ip_forward . It can be set via `sysctl -w net.ipv4.ip_forward=1`.  (also see ipv6 equivalent in there). If this value is false, forwarding won't work, it's a global enable/disable switch.

There is also forwarding configured per bridge/interface: `/proc/sys/net/ipv4/conf/eth0/forwarding`. There is also `all` and `default` in there. 

It should be noted that forwarding is usually disabled in most stock distros, meaning that they won't act as a route packets across networks or across Linux virtual bridges.

Just based on a quick test with my Arch host, enabling the Incus daemon did result in enabling forwarding on all interface, when it wasn't previously enabled. It looks like `ip_forward`, enables forwarding on all interfaces when it is changed to 1. It is also required in order for any forwarding to happen in the first place, it looks like, which is annoying. 

The way to handle the aggressive "router mode", is to ensure the nftables has the forward policy set to drop. On this Arch system,  it looks like ufw does set the nftables FORWARD chain to have a policy of drop (firewalld probably can do/does similar). 

And in hindsight, I do remember having to explicitly allow forwarding to/from the Incus bridge, as documented here: https://linuxcontainers.org/incus/docs/main/howto/network_bridge_firewalld/#ufw-add-rules-for-the-bridge

It seems most likely to me , that Incus OS only manages firewall rules for managed bridges, so looks like "unmanaged" bridges on IncusOS aren't touched, resulting in their forwarding policy being a default of allow.

**Comment by stgraber** [comment]
Yeah, we enable forwarding globally in Incus because we run managed bridges where we are the router and where the expectation is that the traffic coming from the instances needs to be able to reach anything that the host can.

What's odd here is that the kernel would be doing anything with packets arriving on a bridge where it doesn't itself have an address configured, that it would route traffic for an IP family where it has an address would make sense given forwarding=1 being set, but that it does so for packets of an IP family where it does not have an address is very unexpected.

And yeah, we can have IncusOS generate firewall rules blocking forwarding for traffic from a bridge with no IP addresses and clear the rule when the user sets any address or configures it for auto-config, but it's very odd that this is needed in the first place.

**Comment by programmablereya** [comment]
From what I understand from my efforts to figure this out, IP forwarding works like this: if an IP packet arrives at this machine (has a layer 2 hardware address matching the interface on which it arrived) and its destination is not the IP address configured for that interface (has a layer 3 IP address not matching any address on the interface), and we have a route that does match that IP address, then we pick up the packet and re-issue it on the interface matching that route with a layer 2 destination matching the gateway of that route. If the destination IP address is our own IP address for another interface, same thing, except that instead of re-issuing it on that interface, we put it in that interface's receive queue as if it had been received there.

For the empty interface with no IP address configured, it is trivially true that any packet addressed to us on ethernet doesn't have an IP destination in that interface's IP address set, so _every_ such packet gets put into the forwarding chain. Now, if the interface has no subnet and no routes configured, no packets will be forwarded _to_ that interface, which _may_ prevent replies from making it back to the originator - but a stateful router may well remember that connection came via that interface and send replies back via that interface.

We probably _at least_ want the ability to prohibit forwarding to and/or from hardware interfaces. We might even specifically want to always disable forwarding from all hardware interfaces and only allow forwarding from managed bridges, never the unmanaged ones that IncusOS automatically creates or the hardware interfaces that back them. 

If setting an IP address manually or via DHCP/SLAAC turns on forwarding and does not also turn on firewall rules, IncusOS acts as a gateway between all physical networks it's connected to, and there is no way for the administrator to prevent this from happening - meaning that you can only ever use IncusOS on networks that are already supposed to have access to each other some other way. 

That's the exact thing I'm concerned about here, that would have allowed my home and server networks to talk to each other and bypass the firewall's routing.

**Comment by strawberry192** [comment]
I was also looking at virtualizing a router on IncusOS earlier, but looks like that would have to wait. I also think the "least surprising" behavior would be default blocking rule for all forwarding from physical interfaces unless explicitly allowed.

**Comment by programmablereya** [comment]
I just suffered an equipment failure that delayed my response (my development laptop died and has ascended to the clouds as a virtual machine on another PC), but I'd be interested in taking a crack at this once it's decided how IncusOS should handle this!
